{
  "$schema": "https://json-schema.org/draft/2020-12/schema",
  "$id": "https://github.com/GBeurier/dag-ml/schemas/node_result.v1.schema.json",
  "title": "DAG-ML NodeResult v1",
  "type": "object",
  "additionalProperties": false,
  "required": ["node_id", "lineage"],
  "properties": {
    "node_id": {
      "$ref": "#/$defs/identifier"
    },
    "outputs": {
      "type": "object",
      "additionalProperties": {
        "$ref": "#/$defs/handle_ref"
      }
    },
    "predictions": {
      "type": "array",
      "items": {
        "$ref": "#/$defs/prediction_block"
      }
    },
    "observation_predictions": {
      "type": "array",
      "items": {
        "$ref": "#/$defs/observation_prediction_block"
      }
    },
    "aggregated_predictions": {
      "type": "array",
      "items": {
        "$ref": "#/$defs/aggregated_prediction_block"
      }
    },
    "explanations": {
      "type": "array",
      "items": {
        "$ref": "#/$defs/explanation_block"
      }
    },
    "shape_deltas": {
      "type": "array",
      "items": {
        "$ref": "#/$defs/shape_delta"
      }
    },
    "artifacts": {
      "type": "array",
      "items": {
        "$ref": "#/$defs/artifact_ref"
      }
    },
    "artifact_handles": {
      "type": "object",
      "additionalProperties": {
        "$ref": "#/$defs/handle_ref"
      }
    },
    "consumed_data_views": {
      "type": "object",
      "description": "Host-reported materialization reads of scheduler-selected feature views, including possible mask checks; these do not prove estimator consumption or authorize dynamic fit.",
      "additionalProperties": {
        "$ref": "#/$defs/data_view_consumption"
      }
    },
    "fit_influence_diagnostics": {
      "type": "array",
      "items": {
        "$ref": "#/$defs/fit_influence_diagnostic"
      }
    },
    "regression_targets": {
      "type": "array",
      "items": {
        "$ref": "#/$defs/regression_target_block"
      }
    },
    "lineage": {
      "$ref": "#/$defs/lineage_record"
    }
  },
  "$defs": {
    "identifier": {
      "type": "string",
      "minLength": 1,
      "maxLength": 128,
      "pattern": "^[A-Za-z0-9_.:-]+$"
    },
    "non_empty_string": {
      "type": "string",
      "minLength": 1
    },
    "fingerprint": {
      "type": "string",
      "minLength": 1
    },
    "phase": {
      "enum": ["COMPILE", "PLAN", "FIT_CV", "SELECT", "REFIT", "PREDICT", "EXPLAIN"]
    },
    "handle_kind": {
      "enum": ["data", "data_view", "model", "artifact", "prediction", "relation"]
    },
    "prediction_partition": {
      "enum": ["train", "validation", "test", "final"]
    },
    "prediction_level": {
      "enum": ["observation", "sample", "target", "group"]
    },
    "shape_delta_kind": {
      "enum": ["row", "feature", "target", "prediction"]
    },
    "artifact_backend": {
      "enum": ["joblib", "rds", "mat", "torch", "tensorflow", "onnx", "safetensors", "json", "raw"]
    },
    "fit_influence_policy": {
      "enum": [
        "auto",
        "uniform_rows",
        "equal_sample_influence",
        "resample_equalized",
        "backend_loss_weight",
        "scorer_only",
        "strict_weight_support"
      ]
    },
    "fit_influence_mechanism": {
      "enum": [
        "uniform_rows",
        "sample_weights",
        "row_resampling",
        "backend_loss_weights",
        "scorer_only"
      ]
    },
    "fit_influence_diagnostic": {
      "type": "object",
      "additionalProperties": false,
      "required": [
        "requested_policy",
        "effective_policy",
        "mechanism",
        "fallback_used",
        "row_weight_count"
      ],
      "properties": {
        "requested_policy": {
          "$ref": "#/$defs/fit_influence_policy"
        },
        "effective_policy": {
          "$ref": "#/$defs/fit_influence_policy"
        },
        "mechanism": {
          "$ref": "#/$defs/fit_influence_mechanism"
        },
        "fallback_used": {
          "type": "boolean"
        },
        "row_weight_count": {
          "type": "integer",
          "minimum": 0
        },
        "warnings": {
          "type": "array",
          "items": {
            "$ref": "#/$defs/non_empty_string"
          }
        }
      }
    },
    "handle_ref": {
      "type": "object",
      "additionalProperties": false,
      "required": ["handle", "kind", "owner_controller"],
      "properties": {
        "handle": {
          "type": "integer",
          "minimum": 0
        },
        "kind": {
          "$ref": "#/$defs/handle_kind"
        },
        "owner_controller": {
          "$ref": "#/$defs/identifier"
        }
      }
    },
    "data_view_consumption": {
      "type": "object",
      "additionalProperties": false,
      "required": ["receipt", "read_batches"],
      "properties": {
        "receipt": { "$ref": "https://github.com/GBeurier/dag-ml/schemas/node_task.v1.schema.json#/$defs/data_view_receipt" },
        "read_batches": {
          "type": "array",
          "minItems": 1,
          "items": {
            "type": "array",
            "minItems": 1,
            "uniqueItems": true,
            "items": { "$ref": "#/$defs/identifier" }
          }
        },
        "model_calls": {
          "type": "array",
          "items": { "$ref": "#/$defs/model_input_call" }
        }
      }
    },
    "model_input_call": {
      "type": "object",
      "additionalProperties": false,
      "required": ["operation", "sample_ids", "input_fingerprint"],
      "properties": {
        "operation": { "enum": ["fit", "predict", "predict_proba"] },
        "sample_ids": {
          "type": "array",
          "minItems": 1,
          "uniqueItems": true,
          "items": { "$ref": "#/$defs/identifier" }
        },
        "input_fingerprint": { "type": "string", "pattern": "^[0-9a-f]{64}$" },
        "target_fingerprint": { "type": "string", "pattern": "^[0-9a-f]{64}$" }
      }
    },
    "prediction_block": {
      "type": "object",
      "additionalProperties": false,
      "required": [
        "producer_node",
        "partition",
        "fold_id",
        "sample_ids",
        "values"
      ],
      "properties": {
        "prediction_id": {
          "type": ["string", "null"]
        },
        "producer_node": {
          "$ref": "#/$defs/identifier"
        },
        "partition": {
          "$ref": "#/$defs/prediction_partition"
        },
        "fold_id": {
          "anyOf": [
            { "$ref": "#/$defs/identifier" },
            { "type": "null" }
          ]
        },
        "sample_ids": {
          "type": "array",
          "items": {
            "$ref": "#/$defs/identifier"
          }
        },
        "values": {
          "type": "array",
          "items": {
            "type": "array",
            "items": {
              "type": "number"
            }
          }
        },
        "target_names": {
          "type": "array",
          "items": {
            "$ref": "#/$defs/non_empty_string"
          }
        }
      }
    },
    "observation_prediction_block": {
      "type": "object",
      "additionalProperties": false,
      "required": [
        "producer_node",
        "partition",
        "fold_id",
        "observation_ids",
        "values"
      ],
      "properties": {
        "prediction_id": {
          "type": ["string", "null"]
        },
        "producer_node": {
          "$ref": "#/$defs/identifier"
        },
        "partition": {
          "$ref": "#/$defs/prediction_partition"
        },
        "fold_id": {
          "anyOf": [
            { "$ref": "#/$defs/identifier" },
            { "type": "null" }
          ]
        },
        "observation_ids": {
          "type": "array",
          "items": {
            "$ref": "#/$defs/identifier"
          }
        },
        "values": {
          "type": "array",
          "items": {
            "type": "array",
            "items": {
              "type": "number"
            }
          }
        },
        "weights": {
          "type": "array",
          "items": {
            "type": "number"
          }
        },
        "target_names": {
          "type": "array",
          "items": {
            "$ref": "#/$defs/non_empty_string"
          }
        }
      }
    },
    "regression_target_block": {
      "type": "object",
      "additionalProperties": false,
      "required": ["level", "unit_ids", "values"],
      "properties": {
        "level": { "$ref": "#/$defs/prediction_level" },
        "unit_ids": {
          "type": "array",
          "items": { "$ref": "#/$defs/prediction_unit_id" }
        },
        "values": {
          "type": "array",
          "items": { "type": "array", "items": { "type": "number" } }
        },
        "validity_masks": {
          "description": "Optional sample-major boolean mask matching values; true means observed. Absent or null means all observed. All transported values must be finite; hidden cells are canonicalized to zero by the coordinator.",
          "type": ["array", "null"],
          "items": { "type": "array", "items": { "type": "boolean" } }
        },
        "target_names": {
          "type": "array",
          "items": { "$ref": "#/$defs/non_empty_string" }
        }
      }
    },
    "aggregated_prediction_block": {
      "type": "object",
      "additionalProperties": false,
      "required": [
        "producer_node",
        "partition",
        "fold_id",
        "level",
        "unit_ids",
        "values"
      ],
      "properties": {
        "prediction_id": {
          "type": ["string", "null"]
        },
        "producer_node": {
          "$ref": "#/$defs/identifier"
        },
        "partition": {
          "$ref": "#/$defs/prediction_partition"
        },
        "fold_id": {
          "anyOf": [
            { "$ref": "#/$defs/identifier" },
            { "type": "null" }
          ]
        },
        "level": {
          "$ref": "#/$defs/prediction_level"
        },
        "unit_ids": {
          "type": "array",
          "items": {
            "$ref": "#/$defs/prediction_unit_id"
          }
        },
        "values": {
          "type": "array",
          "items": {
            "type": "array",
            "items": {
              "type": "number"
            }
          }
        },
        "target_names": {
          "type": "array",
          "items": {
            "$ref": "#/$defs/non_empty_string"
          }
        }
      }
    },
    "explanation_block": {
      "type": "object",
      "additionalProperties": false,
      "required": ["producer_node", "method", "payload"],
      "properties": {
        "producer_node": {
          "$ref": "#/$defs/identifier"
        },
        "method": {
          "$ref": "#/$defs/non_empty_string"
        },
        "target_name": {
          "$ref": "#/$defs/non_empty_string"
        },
        "payload": {}
      }
    },
    "prediction_unit_id": {
      "type": "object",
      "additionalProperties": false,
      "required": ["level", "id"],
      "properties": {
        "level": {
          "enum": ["sample", "target", "group"]
        },
        "id": {
          "$ref": "#/$defs/identifier"
        }
      }
    },
    "shape_delta": {
      "type": "object",
      "additionalProperties": false,
      "required": ["node_id", "kind", "before_fingerprint", "after_fingerprint"],
      "properties": {
        "node_id": {
          "$ref": "#/$defs/identifier"
        },
        "kind": {
          "$ref": "#/$defs/shape_delta_kind"
        },
        "before_fingerprint": {
          "$ref": "#/$defs/fingerprint"
        },
        "after_fingerprint": {
          "$ref": "#/$defs/fingerprint"
        },
        "metadata": {
          "type": "object"
        }
      }
    },
    "artifact_ref": {
      "type": "object",
      "additionalProperties": false,
      "required": ["id", "kind", "controller_id", "size_bytes"],
      "properties": {
        "id": {
          "$ref": "#/$defs/identifier"
        },
        "kind": {
          "$ref": "#/$defs/non_empty_string"
        },
        "controller_id": {
          "$ref": "#/$defs/identifier"
        },
        "backend": {
          "anyOf": [
            { "$ref": "#/$defs/artifact_backend" },
            { "type": "null" }
          ]
        },
        "uri": {
          "type": ["string", "null"]
        },
        "content_fingerprint": {
          "type": ["string", "null"]
        },
        "size_bytes": {
          "type": ["integer", "null"],
          "minimum": 0
        },
        "plugin": {
          "type": ["string", "null"]
        },
        "plugin_version": {
          "type": ["string", "null"]
        },
        "abi_major": {
          "type": ["integer", "null"], "minimum": 1
        },
        "abi_min_minor": {
          "type": ["integer", "null"], "minimum": 0
        },
        "native_predictor_descriptor": {
          "anyOf": [
            { "$ref": "https://github.com/GBeurier/dag-ml/schemas/native_predictor_descriptor.v1.schema.json" },
            { "type": "null" }
          ]
        },
        "native_estimator_descriptor": {
          "anyOf": [
            { "$ref": "https://github.com/GBeurier/dag-ml/schemas/native_estimator_descriptor.v1.schema.json" },
            { "type": "null" }
          ]
        }
      }
    },
    "lineage_record": {
      "type": "object",
      "additionalProperties": false,
      "required": [
        "record_id",
        "run_id",
        "node_id",
        "phase",
        "controller_id",
        "controller_version",
        "variant_id",
        "fold_id",
        "params_fingerprint",
        "data_model_shape_fingerprint",
        "aggregation_policy_fingerprint",
        "seed"
      ],
      "properties": {
        "record_id": {
          "$ref": "#/$defs/identifier"
        },
        "run_id": {
          "$ref": "#/$defs/identifier"
        },
        "node_id": {
          "$ref": "#/$defs/identifier"
        },
        "phase": {
          "$ref": "#/$defs/phase"
        },
        "controller_id": {
          "$ref": "#/$defs/identifier"
        },
        "controller_version": {
          "$ref": "#/$defs/non_empty_string"
        },
        "variant_id": {
          "anyOf": [
            { "$ref": "#/$defs/identifier" },
            { "type": "null" }
          ]
        },
        "fold_id": {
          "anyOf": [
            { "$ref": "#/$defs/identifier" },
            { "type": "null" }
          ]
        },
        "branch_path": {
          "type": "array",
          "items": {
            "$ref": "#/$defs/identifier"
          }
        },
        "input_lineage": {
          "type": "array",
          "items": {
            "$ref": "#/$defs/identifier"
          }
        },
        "artifact_refs": {
          "type": "array",
          "items": {
            "$ref": "#/$defs/artifact_ref"
          }
        },
        "params_fingerprint": {
          "$ref": "#/$defs/fingerprint"
        },
        "data_model_shape_fingerprint": {
          "type": ["string", "null"]
        },
        "aggregation_policy_fingerprint": {
          "type": ["string", "null"]
        },
        "seed": {
          "type": ["integer", "null"],
          "minimum": 0
        },
        "unsafe_flags": {
          "type": "array",
          "uniqueItems": true,
          "items": {
            "$ref": "#/$defs/non_empty_string"
          }
        },
        "metrics": {
          "type": "object",
          "additionalProperties": {
            "type": "number"
          }
        },
        "loss_attestations": {
          "type": "array",
          "description": "One attestation per resolved training-loss role for the task phase, preserving the node plan's strict (output_id, phases) order.",
          "items": {
            "$ref": "https://github.com/GBeurier/dag-ml/schemas/loss_execution_attestation.v1.schema.json"
          }
        },
        "target_domain": { "anyOf": [{ "$ref": "https://github.com/GBeurier/dag-ml/schemas/target_domain.v1.schema.json" }, { "type": "null" }] },
        "early_stopping_records": {
          "type": "array",
          "description": "Controller-reported stopping outcomes, distinct from persisted metric score sets.",
          "items": {
            "$ref": "https://github.com/GBeurier/dag-ml/schemas/early_stopping_record.v1.schema.json"
          }
        }
      }
    }
  }
}
